{
  "admission_effect": "does_not_admit_direct_source_ingestion",
  "artifact_policy": "digest_only_report_with_reviewable_plain_data_golden",
  "blocked_compiler_outputs": [
    "metadata",
    "compute_graph",
    "tlir",
    "hac_ir",
    "hs_ir",
    "runtime_plan",
    "backend_decision"
  ],
  "blocked_execution_surfaces": [
    "backend_artifact_execution",
    "bytecode_compilation",
    "decorator_evaluation",
    "device_access",
    "dynamic_library_loading",
    "environment_dependent_behavior",
    "file_system_access",
    "frontend_module_import",
    "generated_artifact_execution",
    "network_access",
    "plugin_discovery",
    "python_function_inspection",
    "subprocess_execution",
    "triton_jit_execution"
  ],
  "case_count": 2,
  "cases": [
    {
      "case_id": "admitted_slice_matmul_elementwise_plain_data_golden",
      "default_parser_status": "default_parser_blocked",
      "line_count": 5,
      "operation_count": 2,
      "operation_families": [
        "elementwise",
        "matmul"
      ],
      "parser_contract": "source_to_intent_research_parser.execution_free.v0",
      "parser_output_policy": "source_intent.v0_plain_data_only",
      "parser_status": "research_explicit_only",
      "plain_data_digest": "sha256:20b83d9aebaf4b231ccb37c55171faef3ce258efb6fb0d8df422108fe1a7bb4f",
      "public_returns": [
        "y"
      ],
      "return_count": 1,
      "source_bytes": 162,
      "source_digest": "sha256:ad113b078fe24fcd871fbfb3f95b03e6192dbad3e607bbb737a9e09aa92f9bad",
      "source_intent_contract": "source_intent_ir.canonical.v0",
      "source_intent_schema_version": "source_intent.v0",
      "source_name": "research_matmul_elementwise",
      "tensor_count": 4
    },
    {
      "case_id": "admitted_slice_softmax_reduction_plain_data_golden",
      "default_parser_status": "default_parser_blocked",
      "line_count": 5,
      "operation_count": 2,
      "operation_families": [
        "reduction",
        "softmax"
      ],
      "parser_contract": "source_to_intent_research_parser.execution_free.v0",
      "parser_output_policy": "source_intent.v0_plain_data_only",
      "parser_status": "research_explicit_only",
      "plain_data_digest": "sha256:564d02eea5ca680d08794fa746320371f8b189cc63047832b9360330af9aa457",
      "public_returns": [
        "y"
      ],
      "return_count": 1,
      "source_bytes": 146,
      "source_digest": "sha256:4256aa2ead107dfd1fe3b5cad55224c19c52aaad4aa23fc3590bdc5cc641d230",
      "source_intent_contract": "source_intent_ir.canonical.v0",
      "source_intent_schema_version": "source_intent.v0",
      "source_name": "research_softmax_reduction",
      "tensor_count": 3
    }
  ],
  "direct_source_ingestion": false,
  "evidence_id": "source_to_intent_plain_data_output_golden_for_admitted_slice",
  "golden_contract": "source_to_intent_plain_data_output_golden_for_admitted_slice.data_only.v0",
  "golden_status": "complete_non_admitting",
  "issues": [],
  "operation_family_coverage": [
    "elementwise",
    "matmul",
    "reduction",
    "softmax"
  ],
  "operation_family_coverage_complete": true,
  "output_policy": "source_intent.v0_plain_data_only",
  "plain_data_schema_version": "tuc.source_to_intent_plain_data_output_golden_for_admitted_slice_plain_data.v0",
  "raw_source_policy": "omitted_by_policy",
  "report_digest": "sha256:9efd554d0368fa117f9ce1d9b6e3d7fdad51b58c07b28ed7acb7e558a920c207",
  "required_control_count": 17,
  "required_controls": [
    "bounded_source_buffer_api_bound",
    "source_ingestion_sandbox_implementation_bound",
    "parser_fuzz_negative_corpus_bound",
    "source_free_diagnostics_admission_tests_bound",
    "source_intent_plain_data_validates_through_intake",
    "source_intent_plain_data_digest_bound",
    "source_intent_plain_data_only",
    "reviewable_plain_data_golden",
    "raw_source_omitted",
    "direct_source_ingestion_remains_blocked",
    "no_source_to_compute_graph",
    "no_source_to_hac_ir",
    "no_source_to_runtime_plan",
    "no_python_import",
    "no_triton_jit",
    "no_device_access",
    "no_generated_artifacts"
  ],
  "schema_version": "tuc.source_to_intent_plain_data_output_golden_for_admitted_slice_report.v0",
  "source_free_diagnostics_evidence": {
    "contract": "source_free_diagnostics_admission_tests.data_only.v0",
    "digest": "sha256:15d7299df650e6778c6fa005ab1d7aa68aa8251ecc940598d8af6d44e3d6b868",
    "evidence_id": "source_free_diagnostics_admission_tests",
    "source_free": true,
    "status": "complete_non_admitting",
    "supports_golden": true
  },
  "source_intent_contract": "source_intent_ir.canonical.v0",
  "source_intent_schema_version": "source_intent.v0",
  "source_to_compute_graph": false,
  "source_to_hac_ir": false,
  "source_to_intent_plain_data_output_golden": true,
  "source_to_runtime_plan": false,
  "target_slice": "bounded_source_buffer_to_source_intent_plain_data"
}
